{
  "schemaVersion": 1,
  "mediaVersion": 1,
  "theme": "retro",
  "visuals": [
    {
      "mediaId": "arena-ellipse",
      "alias": "retro:arena-ellipse:v1",
      "src": "/media/default/arenas/arena-ellipse.svg?v=1",
      "category": "arenas",
      "renderMode": "vector",
      "sizing": "stretch",
      "sourceScope": "default"
    },
    {
      "mediaId": "arena-polygon",
      "alias": "retro:arena-polygon:v1",
      "src": "/media/default/arenas/arena-polygon.svg?v=1",
      "category": "arenas",
      "renderMode": "vector",
      "sizing": "stretch",
      "sourceScope": "default"
    },
    {
      "mediaId": "arena-standard",
      "alias": "retro:arena-standard:v1",
      "src": "/media/default/arenas/arena-standard.svg?v=1",
      "category": "arenas",
      "renderMode": "vector",
      "sizing": "stretch",
      "sourceScope": "default"
    },
    {
      "mediaId": "coin-standard",
      "alias": "retro:coin-standard:v1",
      "src": "/media/default/coins/coin-standard.svg?v=1",
      "category": "coins",
      "renderMode": "vector",
      "sizing": "contain",
      "sourceScope": "default"
    },
    {
      "mediaId": "field-conveyor",
      "alias": "retro:field-conveyor:v1",
      "src": "/media/default/obstacles/field-conveyor.svg?v=1",
      "category": "obstacles",
      "renderMode": "vector",
      "sizing": "stretch",
      "sourceScope": "default"
    },
    {
      "mediaId": "field-radial",
      "alias": "retro:field-radial:v1",
      "src": "/media/default/obstacles/field-radial.svg?v=1",
      "category": "obstacles",
      "renderMode": "vector",
      "sizing": "stretch",
      "sourceScope": "default"
    },
    {
      "mediaId": "obstacle-moving-circle",
      "alias": "retro:obstacle-moving-circle:v1",
      "src": "/media/default/obstacles/obstacle-moving-circle.svg?v=1",
      "category": "obstacles",
      "renderMode": "vector",
      "sizing": "contain",
      "sourceScope": "default"
    },
    {
      "mediaId": "obstacle-moving-diamond",
      "alias": "retro:obstacle-moving-diamond:v1",
      "src": "/media/default/obstacles/obstacle-moving-diamond.svg?v=1",
      "category": "obstacles",
      "renderMode": "vector",
      "sizing": "contain",
      "sourceScope": "default"
    },
    {
      "mediaId": "obstacle-moving-rect",
      "alias": "retro:obstacle-moving-rect:v1",
      "src": "/media/default/obstacles/obstacle-moving-rect.svg?v=1",
      "category": "obstacles",
      "renderMode": "vector",
      "sizing": "stretch",
      "sourceScope": "default"
    },
    {
      "mediaId": "obstacle-orbiter",
      "alias": "retro:obstacle-orbiter:v1",
      "src": "/media/default/obstacles/obstacle-orbiter.svg?v=1",
      "category": "obstacles",
      "renderMode": "vector",
      "sizing": "contain",
      "sourceScope": "default"
    },
    {
      "mediaId": "obstacle-phase-gate",
      "alias": "retro:obstacle-phase-gate:v1",
      "src": "/media/default/obstacles/obstacle-phase-gate.svg?v=1",
      "category": "obstacles",
      "renderMode": "vector",
      "sizing": "stretch",
      "sourceScope": "default"
    },
    {
      "mediaId": "obstacle-pulse-block",
      "alias": "retro:obstacle-pulse-block:v1",
      "src": "/media/default/obstacles/obstacle-pulse-block.svg?v=1",
      "category": "obstacles",
      "renderMode": "vector",
      "sizing": "stretch",
      "sourceScope": "default"
    },
    {
      "mediaId": "obstacle-spinner",
      "alias": "retro:obstacle-spinner:v1",
      "src": "/media/default/obstacles/obstacle-spinner.svg?v=1",
      "category": "obstacles",
      "renderMode": "vector",
      "sizing": "stretch",
      "sourceScope": "default"
    },
    {
      "mediaId": "obstacle-static-circle",
      "alias": "retro:obstacle-static-circle:v1",
      "src": "/media/default/obstacles/obstacle-static-circle.svg?v=1",
      "category": "obstacles",
      "renderMode": "vector",
      "sizing": "contain",
      "sourceScope": "default"
    },
    {
      "mediaId": "obstacle-static-diamond",
      "alias": "retro:obstacle-static-diamond:v1",
      "src": "/media/default/obstacles/obstacle-static-diamond.svg?v=1",
      "category": "obstacles",
      "renderMode": "vector",
      "sizing": "contain",
      "sourceScope": "default"
    },
    {
      "mediaId": "obstacle-static-rect",
      "alias": "retro:obstacle-static-rect:v1",
      "src": "/media/default/obstacles/obstacle-static-rect.svg?v=1",
      "category": "obstacles",
      "renderMode": "vector",
      "sizing": "stretch",
      "sourceScope": "default"
    },
    {
      "mediaId": "obstacle-switch-barrier",
      "alias": "retro:obstacle-switch-barrier:v1",
      "src": "/media/default/obstacles/obstacle-switch-barrier.svg?v=1",
      "category": "obstacles",
      "renderMode": "vector",
      "sizing": "stretch",
      "sourceScope": "default"
    },
    {
      "mediaId": "obstacle-tracking-circle",
      "alias": "retro:obstacle-tracking-circle:v1",
      "src": "/media/default/obstacles/obstacle-tracking-circle.svg?v=1",
      "category": "obstacles",
      "renderMode": "vector",
      "sizing": "contain",
      "sourceScope": "default"
    },
    {
      "mediaId": "obstacle-tracking-diamond",
      "alias": "retro:obstacle-tracking-diamond:v1",
      "src": "/media/default/obstacles/obstacle-tracking-diamond.svg?v=1",
      "category": "obstacles",
      "renderMode": "vector",
      "sizing": "contain",
      "sourceScope": "default"
    },
    {
      "mediaId": "obstacle-tracking-rect",
      "alias": "retro:obstacle-tracking-rect:v1",
      "src": "/media/default/obstacles/obstacle-tracking-rect.svg?v=1",
      "category": "obstacles",
      "renderMode": "vector",
      "sizing": "stretch",
      "sourceScope": "default"
    },
    {
      "mediaId": "power-coin-magnet",
      "alias": "retro:power-coin-magnet:v1",
      "src": "/media/default/powers/power-coin-magnet.svg?v=1",
      "category": "powers",
      "renderMode": "vector",
      "sizing": "contain",
      "sourceScope": "default"
    },
    {
      "mediaId": "power-full-shield",
      "alias": "retro:power-full-shield:v1",
      "src": "/media/default/powers/power-full-shield.svg?v=1",
      "category": "powers",
      "renderMode": "vector",
      "sizing": "contain",
      "sourceScope": "default"
    },
    {
      "mediaId": "power-obstacle-shield",
      "alias": "retro:power-obstacle-shield:v1",
      "src": "/media/default/powers/power-obstacle-shield.svg?v=1",
      "category": "powers",
      "renderMode": "vector",
      "sizing": "contain",
      "sourceScope": "default"
    },
    {
      "mediaId": "power-route-scan",
      "alias": "retro:power-route-scan:v1",
      "src": "/media/default/powers/power-route-scan.svg?v=1",
      "category": "powers",
      "renderMode": "vector",
      "sizing": "contain",
      "sourceScope": "default"
    },
    {
      "mediaId": "power-slow-field",
      "alias": "retro:power-slow-field:v1",
      "src": "/media/default/powers/power-slow-field.svg?v=1",
      "category": "powers",
      "renderMode": "vector",
      "sizing": "contain",
      "sourceScope": "default"
    },
    {
      "mediaId": "start-pad",
      "alias": "retro:start-pad:v1",
      "src": "/media/default/targets/start-pad.svg?v=1",
      "category": "targets",
      "renderMode": "vector",
      "sizing": "contain",
      "sourceScope": "default"
    },
    {
      "mediaId": "switch-pad",
      "alias": "retro:switch-pad:v1",
      "src": "/media/default/targets/switch-pad.svg?v=1",
      "category": "targets",
      "renderMode": "vector",
      "sizing": "contain",
      "sourceScope": "default"
    },
    {
      "mediaId": "target-bonus",
      "alias": "retro:target-bonus:v1",
      "src": "/media/default/bonus/target-bonus.svg?v=1",
      "category": "bonus",
      "renderMode": "vector",
      "sizing": "contain",
      "sourceScope": "default"
    },
    {
      "mediaId": "target-main",
      "alias": "retro:target-main:v1",
      "src": "/media/default/targets/target-main.svg?v=1",
      "category": "targets",
      "renderMode": "vector",
      "sizing": "contain",
      "sourceScope": "default"
    },
    {
      "mediaId": "token-circle",
      "alias": "retro:token-circle:v1",
      "src": "/media/default/tokens/token-circle.svg?v=1",
      "category": "tokens",
      "renderMode": "vector",
      "sizing": "contain",
      "sourceScope": "default"
    },
    {
      "mediaId": "token-diamond",
      "alias": "retro:token-diamond:v1",
      "src": "/media/default/tokens/token-diamond.svg?v=1",
      "category": "tokens",
      "renderMode": "vector",
      "sizing": "contain",
      "sourceScope": "default"
    },
    {
      "mediaId": "token-rect",
      "alias": "retro:token-rect:v1",
      "src": "/media/default/tokens/token-rect.svg?v=1",
      "category": "tokens",
      "renderMode": "vector",
      "sizing": "contain",
      "sourceScope": "default"
    }
  ],
  "audio": [
    {
      "soundId": "ambience",
      "sources": [
        "/media/themes/retro/audio/ambience.webm?v=1",
        "/media/themes/retro/audio/ambience.mp3?v=1"
      ],
      "settings": {
        "volume": 0.22,
        "cooldownMs": 0,
        "loop": true,
        "fadeInMs": 1200,
        "fadeOutMs": 800,
        "channel": "ambience"
      },
      "fileSourceScope": "theme",
      "settingsSourceScope": "default"
    },
    {
      "soundId": "attempt-failed",
      "sources": [
        "/media/themes/retro/audio/attempt-failed.webm?v=1",
        "/media/themes/retro/audio/attempt-failed.mp3?v=1"
      ],
      "settings": {
        "volume": 0.65,
        "cooldownMs": 250,
        "loop": false,
        "fadeInMs": 0,
        "fadeOutMs": 0,
        "channel": "effects"
      },
      "fileSourceScope": "theme",
      "settingsSourceScope": "default"
    },
    {
      "soundId": "bonus-accepted",
      "sources": [